{
  "agent": "market_intelligence",
  "company": "docebo-agenthub",
  "scenario_type": "new_product_launch",
  "generated_at": "2026-06-14T00:00:00Z",
  "executive_summary": "Docebo AgentHub launches into the intersection of three large, fast-growing software markets - corporate LMS/learning (~$14.5-16.3B, ~20-23% CAGR), enterprise knowledge management software (~$13.7-26.4B, ~14-18% CAGR), and skills intelligence/talent marketplace (~$9.6-9.8B, ~11-19% CAGR) - for a combined adjacent TAM of roughly $40-50B, though the specific converged 'learning + knowledge + skills with agentic AI' category AgentHub is defining is itself Emerging and not yet sized by analysts. The underlying markets are in a Growth stage with active M&A consolidation (Docebo's own Zive and 365Talents acquisitions), and the opportunity is propelled by one dominant macro shift: enterprise agentic AI moving from <5% of enterprise apps in 2025 to a forecast 40% by 2026 (Gartner), colliding with documented knowledge fragmentation (employees lose 1.8-3.6 hrs/day across 5+ systems) and the rise of skills-based organizations. Competitive density is moderate-to-crowded within each adjacent lane but sparse for the exact closed loop: legacy LMS/HCM suites (Cornerstone, SAP SuccessFactors, Workday) have learning and partial skills but cannot ingest 20+ live knowledge sources or auto-generate content; AI-search players (Glean at ~$300M ARR/$7.2B valuation, Microsoft Copilot) surface knowledge brilliantly but never convert it into trackable learning or close the skills loop. North America is the commercial center of gravity (~40% of LMS spend, ~74% of Docebo's FY2025 revenue, highest AI adoption), while EMEA is fastest-growing but compliance-led - the EU AI Act (high-risk HR AI obligations from Aug 2, 2026) stacked on GDPR makes EU data residency and BSI C5 gating procurement criteria, and Zive's German roots are a genuine, defensible DACH wedge. Buying is committee-driven (~11 stakeholders spanning CLO/CHRO, L&D, IT/Security/DPO, Procurement and Finance) with 6-12 month enterprise sales cycles and LMS contract values averaging ~$72K and reaching six figures; AgentHub's agentic three-in-one scope raises the IT/Security/governance bar and lengthens cycles, especially in EMEA. The dominant incumbent GTM is sales-led, land-and-expand off an installed base, with Microsoft Copilot the lone PLG/self-serve outlier and the single biggest distribution threat. Overall disruption risk is HIGH: AgentHub is launching into a space attacked simultaneously by big tech (Microsoft Copilot + Viva Learning Agent), AI-native challengers (Glean), and HCM incumbents adding agents (Workday+Sana, SAP Joule, Gloat) - while AgentHub's own AI agents are not live until fall 2026 - so speed to GA, category evangelization, land-and-expand off the existing LMS base, and the closed-loop + EU-compliance differentiators are the decisive variables.",
  "questions": {
    "Q1": {
      "question_id": "Q1",
      "question_title": "Market State and Trajectory",
      "confidence": "Medium",
      "findings": {
        "market_size": {
          "tam": "Combined adjacent TAM ~USD 40-50B (2025-2026): Corporate LMS/learning ~USD 14.49-16.33B (2025); Enterprise Knowledge Management software ~USD 13.70-26.4B (2025); Skills intelligence / talent marketplace ~USD 9.6-9.8B (2024). The converged 'learning + knowledge + skills with agentic AI' category that AgentHub defines is not yet sized by analysts.",
          "tam_source": "Precedence Research / Research and Markets (corporate LMS); Fortune Business Insights / Mordor Intelligence (KM software); Verified Market Reports / OpenPR (talent marketplace & talent intelligence)",
          "sam": "Not reliably quantifiable. A directional SAM is the mid-market-to-enterprise (500+ employee) segment of the corporate LMS market in North America and EMEA, the majority of the ~USD 14.5-16.3B LMS market; no analyst breaks out a SAM for the converged agentic-AI learning+knowledge+skills category.",
          "sam_source": "not available",
          "discrepancy_flag": true,
          "discrepancy_detail": "Two discrepancies reconciled. (1) Enterprise KM market estimates diverge >30% for 2025: ~USD 13.70B (Mordor) to ~USD 23.2B to ~USD 26.4B (2026), with one outlier ~USD 961B likely including services/consulting; software-only KM read as ~USD 13.7-26.4B at ~14-18% CAGR. (2) Cross-source LMS sizing differs by market definition: market-sizing cites CORPORATE LMS at ~USD 14.49B (Precedence) to ~USD 16.33B (Research and Markets) for 2025, while the geography sub-agent cites the broader GLOBAL LMS market (incl. academic/education) at ~USD 31.6-37.1B for 2026. These are not contradictory - they measure different scopes; the corporate-LMS figure is the more relevant denominator for AgentHub's enterprise target, and the broader figure is retained only for NA-share context (NA ~40% / ~USD 13.49B)."
        },
        "growth_rate": {
          "rate": "Corporate LMS ~20-23% CAGR (mid ~22%); Enterprise KM software ~14-18% CAGR (mid ~17.7%); Skills/talent intelligence ~11-19% CAGR (talent marketplace ~10.9%, talent intelligence ~18.7%); underlying agentic AI agents market ~44-46% CAGR through 2030.",
          "period": "2025/2026 base year through 2030-2034 depending on report",
          "source": "natlawreview/researchandmarkets (LMS 22.9%/22.0%), Precedence Research (LMS 19.65%), Mordor/Fortune Business Insights (KM 17.7-18.5%), OpenPR/Verified Market Reports (talent intelligence 18.7%, talent marketplace 10.9%), Gartner/tech-insider.org (agentic AI 44-46%)"
        },
        "maturity_stage": {
          "classification": "Growth",
          "evidence": [
            "The three underlying markets are in clear Growth stage with double-digit CAGRs (LMS ~20-23%, KM ~14-18%, skills/talent ~11-19%) and large established incumbents (Cornerstone, SAP SuccessFactors, Workday, Notion, Guru, Gloat, Eightfold).",
            "Active consolidation and M&A signal a maturing core but expanding frontier: Docebo acquired Zive (enterprise AI/knowledge) and 365Talents (skills intelligence, ~USD 54.6M, Jan 2026) to bundle learning + knowledge + skills.",
            "Strong new-entrant and funding velocity at the AI-native edge: Glean reached ~USD 300M ARR (May 2026) at a USD 7.2B valuation after a USD 150M Series F, powering 100M+ agent actions annually.",
            "High and rising demand-side adoption: 61% of organizations have fully/partially adopted or are testing AI in L&D and 52% of L&D teams are increasing AI tool use in 2026.",
            "The specific converged category (learning + knowledge + skills + agentic AI) is itself Emerging/undefined - no analyst sizes it yet and AgentHub's agents are not live until fall 2026 - so the picture is a Growth market with an Emerging sub-category being created."
          ]
        },
        "growth_signals": {
          "funding_activity": "Heavy capital flowing into adjacent enterprise-AI-knowledge: Glean raised USD 150M Series F at USD 7.2B (mid-2025), up from USD 4.6B nine months earlier, hitting ~USD 300M ARR by May 2026 (+89% YoY). Docebo (NASDAQ/TSX: DCBO) deployed M&A capital (365Talents ~USD 54.6M + earn-out, Jan 2026; Zive), with ARR USD 248.9M as of Q1 2026, up 10.6% YoY (acceleration from 8.4% FY2025). Skills players (Gloat, Eightfold) continue to attract enterprise budgets.",
          "job_posting_trends": "Not directly quantified via job-board data this pass (gap). Indirect demand signal: HR professionals reportedly spend up to 30% of time searching across systems and only 34% of companies have a formal org-wide reskilling program, indicating large unmet operational need.",
          "new_entrant_rate": "High at the AI-native frontier (Glean plus a wave of enterprise AI search/agent startups) and active incumbent reconfiguration via acquisition (Docebo/Zive/365Talents). The converged category specifically has very few direct entrants because Docebo is among the first to bundle all three layers with agentic AI.",
          "search_interest": "Direct Google Trends data not pulled this pass (gap). Proxy demand strong: Gartner forecasts 40% of enterprise apps will feature task-specific AI agents by 2026 (up from <5% in 2025), the most aggressive adoption curve of any emerging tech in its survey."
        }
      },
      "sources": [
        { "name": "Precedence Research / National Law Review / Research and Markets - Corporate LMS market", "url": "https://www.precedenceresearch.com/corporate-learning-management-system-market", "accessed": "2026-06-14", "relevance": "Corporate LMS market size (USD 14.49-16.33B 2025) and CAGR (19.65-22.9%)" },
        { "name": "Fortune Business Insights / Mordor Intelligence - Knowledge Management Software market", "url": "https://www.fortunebusinessinsights.com/knowledge-management-software-market-110376", "accessed": "2026-06-14", "relevance": "Enterprise KM software market size (USD 13.7-26.4B) and CAGR (14-18.5%); basis for discrepancy flag" },
        { "name": "Verified Market Reports / OpenPR / Business Research Insights - Talent marketplace & talent intelligence", "url": "https://www.verifiedmarketreports.com/product/talent-marketplace-platform-market/", "accessed": "2026-06-14", "relevance": "Skills intelligence / talent marketplace market size (USD 9.6-9.8B 2024) and CAGR (10.9-18.7%)" },
        { "name": "Glean press / CNBC / Sacra", "url": "https://www.glean.com/press/glean-raises-150m-series-f-at-7-2b-valuation-to-accelerate-enterprise-ai-agent-innovation-globally", "accessed": "2026-06-14", "relevance": "Funding velocity and ARR growth in adjacent enterprise AI search/agent market (validation signal)" },